{"$schema":"https://json-schema.org/draft/2020-12/schema","$id":"planner-visual-calibration-qa.schema.json","type":"object","additionalProperties":false,"required":["qa_id","shell","typography","style","occupancy","qualitative_visual_review","professor_physical_template_fidelity","critical_failure_count","aggregate_status"],"properties":{"qa_id":{"const":"PPA-VISUAL-CALIBRATION-QA-001"},"shell":{"$ref":"#/$defs/shell"},"typography":{"$ref":"#/$defs/typography"},"style":{"$ref":"#/$defs/style"},"occupancy":{"$ref":"#/$defs/occupancy"},"qualitative_visual_review":{"const":"blocked_visual_review"},"professor_physical_template_fidelity":{"const":"insufficient_evidence"},"critical_failure_count":{"type":"integer","minimum":0},"aggregate_status":{"enum":["pass","fail"]}},"$defs":{"shell":{"type":"object","additionalProperties":false,"required":["audit_id","aggregate_status","canvas_mismatch_count","title_safe_region_violation_count","content_outside_safe_region_count"],"properties":{"audit_id":{"const":"PPA-SHELL-REVERSE-AUDIT-001"},"aggregate_status":{"enum":["pass","fail"]},"canvas_mismatch_count":{"type":"integer","minimum":0},"title_safe_region_violation_count":{"type":"integer","minimum":0},"content_outside_safe_region_count":{"type":"integer","minimum":0}}},"typography":{"type":"object","additionalProperties":false,"required":["audit_id","aggregate_status","typography_role_mismatch_count","uncontrolled_font_override_count"],"properties":{"audit_id":{"const":"PPA-TYPOGRAPHY-REVERSE-AUDIT-001"},"aggregate_status":{"enum":["pass","fail"]},"typography_role_mismatch_count":{"type":"integer","minimum":0},"uncontrolled_font_override_count":{"const":0}}},"style":{"type":"object","additionalProperties":false,"required":["audit_id","aggregate_status","uncontrolled_style_override_count","native_synthetic_visual_count"],"properties":{"audit_id":{"const":"PPA-STYLE-REVERSE-AUDIT-001"},"aggregate_status":{"enum":["pass","fail"]},"uncontrolled_style_override_count":{"type":"integer","minimum":0},"native_synthetic_visual_count":{"type":"integer","minimum":0}}},"occupancy":{"type":"object","additionalProperties":false,"required":["audit_id","aggregate_status","recipe_registry_family_coverage","review_deck_materialized_family_coverage","fully_occupied_golden_family_coverage","required_content_assignment_failure_count"],"properties":{"audit_id":{"const":"PPA-CONTENT-OCCUPANCY-AUDIT-001"},"aggregate_status":{"enum":["pass","fail"]},"recipe_registry_family_coverage":{"pattern":"^[0-9]+/10$","type":"string"},"review_deck_materialized_family_coverage":{"pattern":"^[0-9]+/10$","type":"string"},"fully_occupied_golden_family_coverage":{"pattern":"^[0-9]+/10$","type":"string"},"required_content_assignment_failure_count":{"type":"integer","minimum":0}}}}}
